{"default_peg_type":"blue","format":"peggle.level","level_seed":345,"motion":"static","name":"long_shot","pegs":[{"id":1,"radius":10,"shape":"circle","type":"blue","x":200,"y":200},{"id":2,"radius":10,"shape":"circle","type":"blue","x":200,"y":800}],"provenance":{"config_sha256":"455757c900c604563865b5195eda2f31cfeba3d8666b6d782390e38c47e91d4d","level_source":"reference/peggle_evolved/src/levels/long_shot.lua","reference_revision":"d17f6e7089b6e761f4367fc6a6dcd5b4da0309b9","reference_tree":"3dc7ddfe19916e149d2531b20c73463c28a202c8"},"schema_version":1,"type_counts":{"blue":0,"green":1,"purple":0,"red":1},"virtual_height":1900,"virtual_width":1200}
