{"default_peg_type":"blue","format":"peggle.level","level_seed":345,"motion":"static","name":"double_long_shot","pegs":[{"id":1,"radius":10,"shape":"circle","type":"blue","x":400,"y":300},{"id":2,"radius":10,"shape":"circle","type":"blue","x":380,"y":334},{"id":3,"radius":10,"shape":"circle","type":"blue","x":420,"y":334},{"id":4,"radius":10,"shape":"circle","type":"blue","x":800,"y":600},{"id":5,"radius":10,"shape":"circle","type":"blue","x":780,"y":634},{"id":6,"radius":10,"shape":"circle","type":"blue","x":820,"y":634},{"id":7,"radius":10,"shape":"circle","type":"blue","x":400,"y":900},{"id":8,"radius":10,"shape":"circle","type":"blue","x":380,"y":934},{"id":9,"radius":10,"shape":"circle","type":"blue","x":420,"y":934},{"id":10,"radius":10,"shape":"circle","type":"blue","x":800,"y":1200},{"id":11,"radius":10,"shape":"circle","type":"blue","x":780,"y":1234},{"id":12,"radius":10,"shape":"circle","type":"blue","x":820,"y":1234}],"provenance":{"config_sha256":"455757c900c604563865b5195eda2f31cfeba3d8666b6d782390e38c47e91d4d","level_source":"reference/peggle_evolved/src/levels/double_long_shot.lua","reference_revision":"d17f6e7089b6e761f4367fc6a6dcd5b4da0309b9","reference_tree":"3dc7ddfe19916e149d2531b20c73463c28a202c8"},"schema_version":1,"type_counts":{"blue":0,"green":0,"purple":0,"red":12},"virtual_height":1900,"virtual_width":1200}
