{"default_peg_type":"blue","format":"peggle.level","level_seed":345,"motion":"static","name":"off_the_wall","pegs":[{"id":1,"radius":10,"shape":"circle","type":"blue","x":40,"y":100},{"id":2,"radius":10,"shape":"circle","type":"blue","x":40,"y":150},{"id":3,"radius":10,"shape":"circle","type":"blue","x":40,"y":200},{"id":4,"radius":10,"shape":"circle","type":"blue","x":40,"y":250},{"id":5,"radius":10,"shape":"circle","type":"blue","x":40,"y":300},{"id":6,"radius":10,"shape":"circle","type":"blue","x":40,"y":350},{"id":7,"radius":10,"shape":"circle","type":"blue","x":40,"y":400},{"id":8,"radius":10,"shape":"circle","type":"blue","x":40,"y":450},{"id":9,"radius":10,"shape":"circle","type":"blue","x":840,"y":100},{"id":10,"radius":10,"shape":"circle","type":"blue","x":840,"y":150},{"id":11,"radius":10,"shape":"circle","type":"blue","x":840,"y":200},{"id":12,"radius":10,"shape":"circle","type":"blue","x":840,"y":250},{"id":13,"radius":10,"shape":"circle","type":"blue","x":840,"y":300},{"id":14,"radius":10,"shape":"circle","type":"blue","x":840,"y":350},{"id":15,"radius":10,"shape":"circle","type":"blue","x":840,"y":400},{"id":16,"radius":10,"shape":"circle","type":"blue","x":840,"y":450}],"provenance":{"config_sha256":"455757c900c604563865b5195eda2f31cfeba3d8666b6d782390e38c47e91d4d","level_source":"reference/peggle_evolved/src/levels/off_the_wall.lua","reference_revision":"d17f6e7089b6e761f4367fc6a6dcd5b4da0309b9","reference_tree":"3dc7ddfe19916e149d2531b20c73463c28a202c8"},"schema_version":1,"type_counts":{"blue":4,"green":2,"purple":0,"red":10},"virtual_height":550,"virtual_width":880}
