{"default_peg_type":"blue","format":"peggle.level","level_seed":123,"motion":"static","name":"circle_level","pegs":[{"id":1,"radius":10,"shape":"circle","type":"blue","x":62,"y":71.670000000000002},{"id":2,"radius":10,"shape":"circle","type":"blue","x":120,"y":71.670000000000002},{"id":3,"radius":10,"shape":"circle","type":"blue","x":173,"y":71.670000000000002},{"id":4,"radius":10,"shape":"circle","type":"blue","x":217,"y":71.670000000000002},{"id":5,"radius":10,"shape":"circle","type":"blue","x":276,"y":75.670000000000002},{"id":6,"radius":10,"shape":"circle","type":"blue","x":90,"y":141.66999999999999},{"id":7,"radius":10,"shape":"circle","type":"blue","x":230,"y":290.67000000000002},{"id":8,"radius":10,"shape":"circle","type":"blue","x":235,"y":154.66999999999999},{"id":9,"radius":10,"shape":"circle","type":"blue","x":474,"y":108.67},{"id":10,"radius":10,"shape":"circle","type":"blue","x":436,"y":184.66999999999999},{"id":11,"radius":10,"shape":"circle","type":"blue","x":376,"y":312.67000000000002},{"id":12,"radius":10,"shape":"circle","type":"blue","x":323,"y":159.66999999999999},{"id":13,"radius":10,"shape":"circle","type":"blue","x":303,"y":277.67000000000002},{"id":14,"radius":10,"shape":"circle","type":"blue","x":477,"y":255.66999999999999},{"id":15,"radius":10,"shape":"circle","type":"blue","x":335,"y":205.66999999999999},{"id":16,"radius":10,"shape":"circle","type":"blue","x":85,"y":261.67000000000002},{"id":17,"radius":10,"shape":"circle","type":"blue","x":285,"y":386.67000000000002},{"id":18,"radius":10,"shape":"circle","type":"blue","x":529,"y":323.67000000000002},{"id":19,"radius":10,"shape":"circle","type":"blue","x":539,"y":161.66999999999999},{"id":20,"radius":10,"shape":"circle","type":"blue","x":362,"y":91.670000000000002},{"id":21,"radius":10,"shape":"circle","type":"blue","x":448,"y":313.67000000000002},{"id":22,"radius":10,"shape":"circle","type":"blue","x":158,"y":222.66999999999999},{"id":23,"radius":10,"shape":"circle","type":"blue","x":62,"y":71.670000000000002},{"id":24,"radius":10,"shape":"circle","type":"blue","x":144,"y":294.67000000000002},{"id":25,"radius":10,"shape":"circle","type":"blue","x":124,"y":415.67000000000002}],"provenance":{"config_sha256":"455757c900c604563865b5195eda2f31cfeba3d8666b6d782390e38c47e91d4d","level_source":"reference/peggle_evolved/src/levels/circle_level.lua","reference_revision":"d17f6e7089b6e761f4367fc6a6dcd5b4da0309b9","reference_tree":"3dc7ddfe19916e149d2531b20c73463c28a202c8"},"schema_version":1,"type_counts":{"blue":13,"green":2,"purple":0,"red":10},"virtual_height":500,"virtual_width":600}
