{"default_peg_type":"blue","format":"peggle.level","level_seed":345,"motion":"static","name":"lucky_bounce","pegs":[{"id":1,"radius":10,"shape":"circle","type":"blue","x":140,"y":450},{"id":2,"radius":10,"shape":"circle","type":"blue","x":182.85714285714286,"y":450},{"id":3,"radius":10,"shape":"circle","type":"blue","x":225.71428571428572,"y":450},{"id":4,"radius":10,"shape":"circle","type":"blue","x":268.57142857142856,"y":450},{"id":5,"radius":10,"shape":"circle","type":"blue","x":311.42857142857144,"y":450},{"id":6,"radius":10,"shape":"circle","type":"blue","x":354.28571428571428,"y":450},{"id":7,"radius":10,"shape":"circle","type":"blue","x":397.14285714285711,"y":450},{"id":8,"radius":10,"shape":"circle","type":"blue","x":440,"y":450},{"id":9,"radius":10,"shape":"circle","type":"blue","x":482.85714285714283,"y":450},{"id":10,"radius":10,"shape":"circle","type":"blue","x":525.71428571428578,"y":450},{"id":11,"radius":10,"shape":"circle","type":"blue","x":568.57142857142856,"y":450},{"id":12,"radius":10,"shape":"circle","type":"blue","x":611.42857142857144,"y":450},{"id":13,"radius":10,"shape":"circle","type":"blue","x":654.28571428571422,"y":450},{"id":14,"radius":10,"shape":"circle","type":"blue","x":697.14285714285711,"y":450},{"id":15,"radius":10,"shape":"circle","type":"blue","x":740,"y":450}],"provenance":{"config_sha256":"455757c900c604563865b5195eda2f31cfeba3d8666b6d782390e38c47e91d4d","level_source":"reference/peggle_evolved/src/levels/lucky_bounce.lua","reference_revision":"d17f6e7089b6e761f4367fc6a6dcd5b4da0309b9","reference_tree":"3dc7ddfe19916e149d2531b20c73463c28a202c8"},"schema_version":1,"type_counts":{"blue":5,"green":0,"purple":0,"red":10},"virtual_height":550,"virtual_width":880}
